{
  "name": "ffrwd/wasm",
  "version": "0.19.1",
  "description": "The ffrwd:av wit world a wasm module is built against, carried as a package: this version's number is the world's. Assets only - no exports, no recipes, no module.",
  "license": "MIT",
  "files": [
    "wit/"
  ],
  "keywords": [
    "wit",
    "wasm",
    "sdk"
  ]
}
